{
  "$id": "forms.consentFieldConfig",
  "name": "Consent Field Configuration",
  "version": "0.9.0",
  "status": "stable",
  "domain": "forms",
  "category": "consent-data",
  "description": "Defines what a consent checkbox or acknowledgement means at capture time.",
  "purpose": "Ensures consent capture includes a purpose and stable text/version snapshot rather than a generic untitled checkbox.",
  "formsModel": {
    "kind": "value-object",
    "customerManaged": true,
    "containsPersonalData": false,
    "publicEligible": true,
    "supportsRevision": true
  },
  "fields": [
    {
      "key": "purpose",
      "required": true,
      "nullable": false,
      "description": "Declared purpose of the acknowledgement.",
      "primitive": "fields.select",
      "config": {
        "options": [
          {
            "value": "terms",
            "label": "terms"
          },
          {
            "value": "privacy",
            "label": "privacy"
          },
          {
            "value": "marketing",
            "label": "marketing"
          },
          {
            "value": "contact",
            "label": "contact"
          },
          {
            "value": "ageConfirmation",
            "label": "ageConfirmation"
          },
          {
            "value": "other",
            "label": "other"
          }
        ]
      }
    },
    {
      "key": "consentText",
      "required": true,
      "nullable": false,
      "description": "Exact user-facing consent/acknowledgement text.",
      "primitive": "fields.textarea",
      "config": {
        "maxLength": 3000,
        "localizable": true
      }
    },
    {
      "key": "policyUrl",
      "required": false,
      "nullable": true,
      "description": "Optional related policy URL.",
      "primitive": "fields.url"
    },
    {
      "key": "policyVersion",
      "required": false,
      "nullable": true,
      "description": "Optional customer policy/version identifier.",
      "primitive": "fields.text",
      "config": {
        "maxLength": 120
      }
    },
    {
      "key": "required",
      "required": true,
      "nullable": false,
      "description": "Whether acceptance is required to submit.",
      "primitive": "fields.boolean",
      "config": {
        "defaultValue": true
      }
    }
  ],
  "relationships": [],
  "validationRules": [
    {
      "id": "noPrecheckedConsent",
      "description": "Consent controls must not be prechecked when an affirmative action is required."
    },
    {
      "id": "marketingConsentIndependent",
      "description": "Marketing consent must not be silently bundled into an unrelated required acknowledgement."
    },
    {
      "id": "notLegalSufficiency",
      "description": "This configuration records product behavior and does not by itself establish legal sufficiency in any jurisdiction."
    }
  ],
  "cms": {
    "label": "Consent Field Configuration",
    "icon": "fa-rectangle-list",
    "customerVisible": true,
    "adminVisible": true,
    "editorMode": "structured",
    "defaultPlacement": "forms",
    "summaryFields": [
      "purpose",
      "consentText",
      "policyUrl",
      "policyVersion"
    ],
    "primaryActions": [
      "view",
      "edit"
    ]
  },
  "delivery": {
    "publicAllowed": true,
    "notes": "Only the explicitly public rendering subset may be delivered to website visitors."
  },
  "futureBindings": {
    "marketing": "phase-9",
    "integrations": "phase-10",
    "events": "phase-13",
    "webhooks": "phase-14",
    "permissions": "phase-15",
    "privacy": "phase-30"
  },
  "examples": {
    "valid": [],
    "invalid": []
  },
  "notes": []
}
